Trimmed Review,Rating
not much   sense  achievement with this one  story  along  progress only depends on how many units you can throw at  enemy  not enough  on unit variations  abilities in terms  strategy  certainly better games  its type out there ,0
i got this game on sale    believe  reviews for this game  story is awesome af btw,0
 campaign is boring  slow   tedious   unit control feels terrible ,0
this is  hard one  make an opinion about  it feels like company  hero is  but less if that makes any sense  it is got  less faction  in fact it only has   groups  space marines  eldar   ork  in dawn  war there are   groups with souls storm  in dawn  war   there is   groups  now there are   groups  that is bad  there are new mechanics that make  game fun  but at  same time you can not get  full experience in any game  it also hurt  game that half  everything is locked off  if you want  play  campaign just youtube it  if you want fun with lots  options  groups play dawn  war     ,0
good game,1
i like when big angry  does cool flips in air,1
its cool,1
i love dawn  war games,1
it  good at  start but what  let down   game  have been dawn off war for  lot years now  am  for my refund can  tell how it takes  get ya money back ,0
i am glad that elites are now unlocked ,1
my god its slow  boring without mods  every mission in  is   minutes  waiting for resources   another   minutes  your troops trying  kill  single troop  your enemies  every skirmish is  same   you wait for god  amount  time  get resources for  single unit   then watch how  space marines try  kill orc troop for    minute   this is literally unplayable without revolution mod   i highly recomend   it  because it makes skirmishes so good  you will not be able  play original game again  if only original game was like this ,0
i have played all  dow so far  this one is not terrible but it is by far  worst  playing as  eldar  which i  enjoy  is just frustrating as it takes them   be able  do anything  it is  only game   series i gave up playing simply because it was not all that enjoyable  even though i did spend   hours on it   bring back  way  first one played ,0
in addition   other reviews     i am  nobody said anything about lol like graphics  especially  heroes  giving thumbs up only in condition  sale buy  if you are  big fan      about  game ,1
i have played all  dawn  war games  this one is pretty fun  would not call it  best out  all  them but pretty fun ,1
good game  ,1
i am so disappointed  if you ever played any other warhammer strategy game  you will be completely  by this game  here is  quick summary why      knights  uber units     that kinda   lore  bit  thats one big thing that was missing in previous warhammer games  negative  you army is completely useless  be honest   there is no balance   your units have no value at all  feel more like   especially  space marines should be these super  but fail do anything but   enemies   campaign     no dedicated campaign but more   gathering  skirmishes  where did   story writing from dawn  war   go  where did  campaign map from dawn  war    dark crusade  soulstorm  go     from dawn  war   gone  base building like in dow   gone  i guess my point here is  that they tried  create  completely new   this was not requested  we loved  way on how dow      worked   details   love  that went into these dows were fantastic ,0
i bought it  i played once   i never asked for money return  worst game  do not waste your time money  if some one know    have  money back  please tell me  i played   hours since i bought it ,0
got it for    still felt cheated    put it off because my friends who play warhammer games would not really touch it  i liked  use warhammer games  play when i can not go  my game groups  i see why they will not,0
looked great  felt like  dawn  war game  some design decisions make it feel  bit  down between an rts   moba  still was an interesting experience considering i got it on sale ,1
this  good game if you like your rts games   campaign is pretty decent  i have played enough  enjoy it   only really bad thing i have  say about this game is  wish it could be more like  original dow series  it is an improvement from dow   but nothing like  originals   overall its  step in  right direction  any  or new dow fans will still get enjoyment from it ,1
this game is fun but i would not recommend it unless you find it really cheap because  game play gets  very quickly,0
enjoyable  play rts with  great warhammer   feel ,1
terrible game ,0
i as  huge dawn  war fan finally decided  get this  play it during   despite  terrible reviews  online   was not worth   do not waste your money   i  do not waste your money     gameplay   average  only campaign as multi player isnt working  graphics   barely updated with less gore  less actual interactions between enemy characters  bugs   half  titans get stuck or can not attack units,0
oh sega  where do i start  all you had  do was take dawn  war  give it this game graphics  that was it  instead  we got  campaign that flips between who knows where  who knows what  terminators front flipping into orks because that is  thing now  eldar that are  well useless because eldar   stupid ork upgrade mechanic that makes no  because most scrap is in  battle  they get  while doing their little   seconds   through   shit oh i mean scrap  which is what relic let sega do  this glorious franchise  dow had twice as much content in it is first instalment than this piece  work  wanna know why  aside from  chaos space marines because you know  relic forgot about dawn  war   chaos rising canon  instead  we get gabriel smashing up stuff due      has forgot that  warp  his chapter   gorgutz somehow coming back from god knows where   some eldar that are  i do not even know why they are here  so in all in  sega gave us  gold old finger instead    game  wait  is this ea  no no  it can not be right  relic  with ea  ,0
great strategy game  fun story based in  history   warhammer series  have not played  others but fairly easy  get into  excellent graphics  fun gameplay  however multiplayer  skirmishes   close    lane based moba   actual game mechanics can be fairly complicated as well    lot  micro management  key     took me  while  get into  work out how  start   best play style for each faction  if you are looking for  good rts then definitely worth  play  however expect it  be more simplified in gameplay  but more complicated with heroes  abilities  which  game heavily depends on  than   or  etc ,1
no necrons  no dark eldars  no tau empire  no chaos spacemarines  no    fun i guess if you like graphics  playing with only   races     rich universe  warhammer  better   dow   ultimate apocalypse ,0
not as good as  original but still fun for  casual play through ,1
it is not  bad game    but if you have played dawn  war      you will not like it at all    instead  going forward they are  back   more  less   for me it is  franchise killer,0
much better than  reviews would indicate  this is  really good rts   fun  play campaign  cool units heroes    overall this is  great game  i recommend it ,1
 franchise killer    warning sign     dawn  war   is  last game relic has made   it is almost impossible   all  things wrong with this entry      in detail  its shortcomings  flaws      is  stuff  hour plus youtube video      with  examples     is points   avoid it   at any price it is  disappointing waste ,0
campaign provided   no experience at all for my elites  either this is  bug  which is  sign    or this was patched   make it harder  level up elites  which is  sign      my experience with this game has been    than i  from reading  mixed reviews      updated review    having completed  campaign  played   skirmishes against  ai  my complaint  has become less clear  i still do not recommend  game  but for  different reason that i will get  at  end   game is playable  good even  if it were not  dawn  war game  it might have    it makes sense for me  start at  beginning   intro video  have you ever looked at  piece  art that looks pretty  but you say  yourself   i do not get it   that is how i felt when i saw  intro  at  end   campaign  it makes more sense  now i can say  i do not like it  instead   i do not get it    but on  some  campaign       varied missions  more varied than dow   or   i can not immediately recall two missions in dow   that played  same      missions  you how  play each faction  dow   does this better than most rts games i have played  due in part  mission variety      terribly    story   plot twist at  end   campaign is   plot twist in warhammer   i mean it  until you get there   campaign does  poor job  out  characters or  story  i had  go on     out why  chapter master   space marines would be so   even     regular human   solaria  when he wears his  for an  on his     ending  well  it just feels wrong in    game      elite units are mostly fun  there is an ork mission toward  end   big gate you should   purely by chance  i brought an  elite that can    gate  so i played  whole mission never smashing open  gate  i do not know if it would have made any difference  but it was fun that i could do it        couple  cheap ai mechanics  mostly toward  end when  re   enemy units are  as  new faction       really nice   dow retribution in  last mission      voice acting is  quality than dow      especially gabriel angelos  gorgutz  angelos  voice is so deep   i half expected him  rip off his power armor  show off his  like an action movie hero  gorgutz   be simultaneously less fun  more  than  ork  in dow    so as i played  campaign  i found  mission themselves enjoyable  but i could not bring myself  care  there was no    this is almost  exact opposite  dow      whose missions get repetitive pretty fast  but whose plot  characters really keeps  game moving forward  as  fan   first two games  this was  huge letdown   yet  for someone who is not    fan   shortcomings   campaign plot likely are not as obvious  it might even be  good  feel good campaign   i have only played  limited number  skirmishes  what i found are these      elites  doctrines add  fun new layer   existing rts formula  if  game were not dead  more elites were added  they might even have created   game      diverse play styles for different factions   differences go  than dow   or   due    new mechanics  drop pods   scrap    webway  soul recall   other smaller unique features      moba  i do not think  power core maps were   be moba  moba games are  not by    towers   core  be destroyed  but rather  emphasis on single unit      neither is  enough in dow      power core maps  i think these maps were just relic is attempt   units into bigger fights  them all over  map  capture control points      why no  point control maps      dow   could have had great  or at least fun    rts  moba gameplay  i think not having  more dedicated moba mode does not count as  minus since it is not   dow   gameplay  it is more   missed opportunity   my problem with  dow   single player can be  with my problem with its intro video  there is good game here  just not  good dow game  possibly  adopt  more        devs     soul  this game  good level variety  fun game play mechanics can not fix that  just as  intro video is simultaneously well made  pointless    multiplayer  or for me  skirmish   is also ok   elites add an interesting new layer   game play  i guess like  super    day rts  it is not quite fleshed out  with more improvements  it might have become great  with more effort   multiplayer could have evolved into separate traditional rts  fun moba game modes  that is not going  happen now   here  my reason for not recommending dow   not because  game is so bad it is not even worth it on sale  but    individual developers    with  game is   i mentioned in  beginning that i  next  no xp for my elites in  campaign  i also could not earn any xp in   maps  i think they were patched out  here is  thing   only people who even care   xp for elites  including achievement   are people who want more out   game  they likely make up  majority   people who still care about  game   devs could easily have gotten rid   skulls  unlocked most elite features without making it harder  elite up elites  which now has almost no gameplay  anyway  instead  they gave  big middle finger  this group  for  game where    players completed  campaign  fewer than half even bothered  finished  third mission   devs did not just burn their   they    so nothing would ever  again   i am so glad philippe boulle left relic ,0
just  copy paste mechanics  nothing too great  all factions are  in terms  building  unit   is just  look   ,0
good,1
much better than  reviews would indicate  people were just mad it had some aspects that  like  but  entirely differently than  moba ,1
playing this game reminds me  when i saw my     when i was  it seemed  lot bigger  better  but as an  i  it is nothing special ,0
not like soulstorm do not recommend,0
great game  please add more content factions    ,1
its shit,0
cheap starcraft  set in    universe  everything feels wrong in connection   setting ,0
first  all  this game is  disgrace for  warhammer   dawn  war franchise  bruh like   all we wanted was more races  play  that same old mechanics from first dawn  war  btw this whole thing could have been  by  few updates buuuut  developers abandoned  game   so do not ever spend  dollar on this game  let us hope they will learn from their   make  better sequel,0
wanted  love it but just no,0
no decent cinematics    battle campaign  in one for all three races   space marines models look like they were  from dow_ii   only three   vs numerous back in dow  dow_ii    when i look at starcraft it makes me so sad  because   deserves  be even better   but its not even close     only thing i liked is how some orcs units  buildings were made ,0
please read  this game is fixed    has  been removed normal  mode is back  game is way better now ,1
its  good  those retards are just baby ,1
its good,1
lovely game after patches   ,1
bad,0
 game is futuristic  very well made in detail   game play is dynamic  diverse  there are many different  that  player can experience  game in connection with units tactics     game has depth   in    warhammer universe  in  new  way    it has   vision  value   franchise   it is sad  see that  lot  people are  with  new angle   game   i understand  appreciate  games    prior  this one   but development  change are always  ,1
good  game,1
get  go     campaign sucks  no loot  no hero leveling as in dowii  no    achievements are buggy  do not unlock  only   playable races  tries  be moba  really  fail   this is really disappointing about   steps backwards especially after games like dowii  company  heroes    assault   go back  play  good ones    assault  soul storm  dark crusade  dowii expansions   sega        its    on     on its way out   ,0
really good  although   was better  they made maps  small in   could have been great ,1
rip dead  never  rise again   real shame though  i feel like  game had potential but  devs tried  turn it into an rts moba hybrid that just didnt work out  story is so  it is just sad  achievements are just finishing  story  grind every elite   level can be easily done with mods  ,0
can not understand all  hate for this game great story good graphics amazing ost  great battles based mostly on micro  ok its  bit different from other dow  rts games but  doesnt mean bad  dow   in his own way is  great game ,1
i did not play warhammer   series before  as   i can say this game is quite good  most  negative reviews are from warhammer fans  when this game does not  their expectation,1
not  big fan   moba elements  very nearly would have preferred   company  heroes ,0
it is good   enjoyed  story  if you like   then  probably like it ,1
good but needs  other races,1
i get it that some people would hate on this game  but for me it is  fun game  ,1
people talk so bad about this game  but have  what dawn  war ii was when it launched  what dawn  war i was when it launched  there were plans  make add ons for this game just like they did with dawn  war ii  add races  campaigns that would have more choice   content within  but this was supposed   us over until then  now  now it is dead  it is sad how  we have all become  we used  just love warhammer  now it is   do better or fucking kill yourself games workshop        i was  bit disappointed too until i  how dow ii was at launch  only game that had  few more races at launch was dow i  that was because no expectations were on them  deliver it   dow ii was   update graphics  ship it out with  quick campaign while learning how  work with  slightly newer system  same thing happened with dow iii but nobody wants  talk about that  just about how they are   everything they want now ,1
if you like games like starcraft ii  warcraft    command   conquer  you will feel at home ,1
please include more race like imperial    tau  dark eldar  chaos  this could be more fun  then make it more strategy gameplay like dow  ,1
warhammer dawn   fails  live up   standards set from previous versions   micro managing is hard lack  other factions  limited amount  units available   textures look cartoony but  shot graphics are good   campaign is bad  i did not feel  love into this game this is  by  spacemarines  being completely off  i give it  thumbs up because its worth     good time   i only plan on finishing  campaign  thats it ,1
they   mass army s from  first game  combined it with  special ability s from    game added  few more features for  race then remove some health  main units making micro  main thing  master for  competitive scene how ever they never fixed all  animation  ai bugs that make characters stuck on other characters or just stuck in an animation loop totally  out  micro   if they just used  month  this game it should have been great  ready for  small e  scene,0
good game ,1
 first two are better  i do not really like this game much  might finish  campaign  might not  prolly just gonna play more dow ii,0
so i have been  dow fan since  first  as i am sure many here have  i have  buying  game for  number  reasons  but honestly upon playing it  i  it was because i kept comparing it   first dow  in its own right  if it  before  first dow style game  i would have loved this game  at  discount  i feel like this is  good purchase for any fan who loves  dow franchise   campaign is somewhat short  but i felt like  missions were varied enough  keep it interesting   as  game is no longer being  however  i have  recommend it only at  discount for true fans   franchise ,1
if you are      its  good enough   pick up    i would wait for  sell  for everyone else looking for  solid rts experience    i would go some where else ,1
great looking game  i preferred  squad feel   second one but going back  traditional rts is still awesome     especially warhammer universe ,1
how  butcher good      in one step  this   when i was playing in   i could not stop  after playing      i had enough  stop playing it for  long time  when i came back  try again  give  shot  it is still not playable  very sad  be honest ,0
after coming off  dawn  war  its sub titles  jumping into this game felt pretty similar    ameh   i heard dow iii played very   dow so i went back   myself on how it played versus dow ii  its sub titles   graphics are great  sound i think comes across as   nothing in  game really  out when     or melee occur   factions are  start  eldar feel   desperate for micro management  orks are orks  space marines are clunky  not in  good way  they came across as  least  than anything   storyline was not really engaging  i play dawn  war  experience  stories   warhammer universe  i think dawn  war  dark   soulstorm  more intriguing story    which they really did not  i did not care enough  try  get  titan    were   did not care about those either    overall i was looking forward   game but left with my    so  speak  i hope something helps in  future  make me want  come back  it    workshop will do what workshop do  all  content  on there  thanks for putting out   content that i feel should have been in  base game ,0
these  do not burn in  fire ,0
i personally enjoyed  time i had with it  i hope relic will pick this game back up again,1
this is not  dawn  war game  dawn  war was amazing  dawn  war two was    different  but at least it still kept with  spirit  this  is some sort  husk   corpse   once great franchise  abandoned by relic  buy at your own risk  it will not change from here ,0
what an  game  i would recommend this  anyone who has ever been involved in  warhammer   universe  not only is  campaign well written   multiplayer is smooth  so much fun  pity  game devs stopped any new content from being   i would pay top  for new content  dlcs    ,1
i like some   new units   i am  eldar        game so good  see  fleet   mechanics      graphics are good   i enjoy  storyline lore    i have only played  first   missions but have liked what i have seen so far   although i think i would have preferred separate single player campaigns for each   races  i do not really do online     my favourite dow is probably  dark crusade with  nice blend    several races  do choose from ,1
 good game  there are options  make it just like  past dows if you are   change  kind  like   skill takes time but is rewarding ,1
ok  so this is another  example  how one   completely  opinion can    or     game on its release  so far all    towards  game in  negative review  is just  bunch   who are very pissed  not have    dawn  war    not  new game which opens  new     would this game not be   it wouldnt  just   storm it did     devs have shit  say either  im in no way  them  they could have      known  community  warhammer   fanbase which i hate   myself   not do   out move with  any support on  game   game is very fun  campaign is very interesting  cool new animations   scale  battle is increased so drastically that it is   as  up as apocalypse mod for soulstorm         matches are very dynamic  you increase  scale  battle with time  for    three  fighting each other like in    you have insane mechanic  elite units too  game is worth its full price in my opinion   get it on  discount ,1
please upvote   keep this  alive   please sega  relic  feral  do not leave this game  i have very good reasons    this one is    bit  i know but i loved it  i would like  see more  like new race   campaign or other mods    modders in workshop also very good  needs more  by trying  liking maybe their work anyone who can  this genre because      this is  fantastic mix  different rts       only has  huge fanbase  people  including me   also  rts  moba players like    gathering    or as i say requisition  energy    race        i mean orc  human    i think huge target  people would give it  try especially if you come again with some  expansion maybe  i would  recommend  share  just like now  thank you in advance,1
played for about     game looks terrible  feels terrible  play  its  shame i loved dow  ,0
no tactics or cover  just make  big ball  units   up  map  shame really ,0
only worth   like what i paid  no  or  or custom maps so basically no online play yet has xp  piece  shit devs who abandoned  game because it got bad reviews  instead  fixing it just said fuck you  well fuck you back   theres no cover system anymore  yet has lots  text  that there was at one point  heroes are unbalanced as shit example  gabriel angelos gets   stuns   gets    eldar hero gets   if you are very fucking talented    certain units you never build because completely useless  every race unit  exactly  same with vehicles being  major difference with small   infantry  most op units are  ones that do full damage  all armor types as usual  some are tier   units   do not even know why i bother  game not getting remade nor is there any dlc coming out  they out for good   this game is fucking shit when it comes  strategy games  have you fucking retards even played one before making this game  theres no  stance  or defensive stance only hold fire or hold still  your units will literally stand there  get fucked until they die because someone they can see but can not  is      them  you didnt command them    when you make ai face  shows you there is no unit balance  heavy  towards  ,0
you are not   ,0
 worst part from all   dawn  war games   too many micromanagement in gameplay   gameplay not exactly  same with previous parts  just   races   boring company   so   just because we have not other good strategy games in warhammer   world         was  ,0
game got linux support recently  i   why not  game is buggy  clunky  does not support  cards yet on  linux side  things  i was  quite  bit    too  just avoid this game  not worth  ,0
 those warhammer   dow fans  this game no worth your money    time  i bought this in  price yet still disappointed when compare  dow   dow    expansion set even dlc     not much fun    yet some   workshop mods content extend this game life  little   please if you want refund  remember  do it before    hours game play  thank you  from  dawn  war   dawn  war   dawn  war   chaos rising  dawn  war   retribution  ,0
look how they  my boy   ,0
its just dull  it looks amazing but  combat is super simple  restrictive  too much micro management  make units  ,0
sucks that relic  ship on this  its  good game  people are mad that its not  dow   copy  its balanced   it has some great content   buy if its on sale,1
takes   bit  getting use   but all fun        ,1
looks great  plays great ,1
i paid   on sale  for that price i would recommend,1
