Trimmed Review,Rating
love it,1
dawn  war   is such  great game in terms  graphic  sound  animation    unfortunately  it lacks good game design  gameplay mechanics that could be fixed   i still hope   somehow could be    do not u get it dev  we want soulstorm in dow   graphics ,1
   e n d  e s s  t   s ,0
if i wanted  play starcraft  i would play starcraft  not  shitty version  it that totally breaks what dow      were  it helps  little now though that i have learned there is  pause button in singleplayer where you can queue commands right about when i am mostly through with  campaign   makes no sense that they increase micro management     quicker   while at  same time increase  scale  fights  combat  unit pop   only thing i can guess what relic was thinking was that they tried too hard  make it like other games  they should have learned by   that dow needs its own formula ,0
i am not one  be negative about games  but this is not worth  buy at all  this game could have been great  relic really let me down on this one  if you are on   about buying it  just pass on it  there are other warhammer titles ,0
very fun game   recommend  game ,1
thanks for   great franchise   despite some nice game design features  this game is an insult  every previous dawn  war instalment  all they had  do was improve on dawn  war ii  they would have ended up with  great game  by every gamer    instead  that they decided   develop  release  garbage game ,0
i started this franchise with dawn  war   i personally like  hero elite form  rts rather than  base building  massive army battles  i have seen many say that dow   is  mixture        that it is not very good  i would   only on  premise that i did not play  original   i think  campaign is very good  even if i do  with it at times  looking at you campaign mission     i have only played  multiplayer with ai     while i do understand  moba feel  i have  say  i kind  enjoy it  i recently also tried  annihilation mode as well  had  fun time with it    i can see where  loyal fans  dawn  war were let down with   but i still feel that it is  great game with  good campaign  pretty decent multiplayer  it is sad that development stopped on dow   but hopefully   will be  game that  loyal fans wanted  i will still be enjoying       eventually will  into  original    ,1
sad  see what was previously an excellent rts series turn down    an moba cash grab  if you like bland   gameplay  look no further ,0
this is  first time i have not completed  games campaign   game was   boring   total waste  money  i was  fan  both dawn  war    could appreciate  different  for each game  however  this game can not  on what it is trying  be      very disappointing    ,0
i will upvote anything with  warhammer  in  name  even if it is    not fantasy    but damn this micromanagement hell is annoying  i do not have enough add  keep track  everything  this game would be  lot more fun if there were not so many  things  micromanage  this is exactly why dow   is failing compared    what were they thinking ,1
been   emperor since  early   is  game is still awesome  although i wish that  chaotic  was  same as back then ,1
this sad blend  rts  moba missed   by sooo much  all they had  do was make new textures  models for dawn  war    one   most fun rts ever   even dawn  war   was better than this  despite all  rts elements they removed   singleplayer was less fun than playing   or   because  gameplay formula is dull  multiplayer was dead on arrival  steam     says  player population    per day currently  it was  moba with extra steps ,0
i feel sorry for  obviously talented sound  graphic designers who worked hard on making this game look  sound  mostly  great    game itself is dull  monotonous  uninspired  just outright boring   same environments   same terrain meant  same tactics    plot was not too bad  until towards  end     into  planet  really    using    orks usually  down    lots  things     which was fine  but  eldar were just fucking terrible which made even  simplest mission frustrating  throw in  regular crashes  oh boy did i save  lot   at times i got so pissed off i had  close steam  do something else    sad disappointment   game which had so much  ,0
fun story  distinct races   gameplay that  up years later  recommended  anyone who loves  good rts ,1
if they would like  make next dawn  war they should abandon almost every idea from this part  due     rts  hard grind present in dow iii is very   deal with  you need  grind level for elites  it is   level  not in match hero level like it was in warcraft   for example   higher  level   more tactics you can pick for your army  hero power stays      same  there is option  disable elites tactics  in match  after which you will get multiplayer experience very close  what was in dow   not terrible but could be better  like in soulstorm for example   elites had  bit wrong   but overall heroes are very  idea in my opinion   it reminds me  warcraft   they give some   old concept  online rts  but they are    especially in  hands  good players   i really do not get  idea  devs for dow overall   they are  it from its unique gameplay  make it more like  company  heroes  i can not say company  heroes is  bad game  but we do not want  see dawn  war as  company  heroes clone but in   universe  let us stay with players most favorite experience from dow i  if you want  make coh clone in   universe  make it as separate game   do not mix them together  it is not working  players do not want  play it  not because it is bad  but because it is not  good   warhammer   i believe this is why call   or  for example is selling so good  because it is stays  same    dow in my personal opinion would be campaign as  result  mixing dark crusade soulstorm dow    with long   bit  story  multiplayer from any dow i expansion  additional   players  co op from dow   that could be playable with bots  i mean it was cool with players  but dow   never had  big   later on  it was impossible  find game    achievements without xp mods from steam workshop will take   pointless grind  get them  game could have  bit better   but there is no point in making it happen in this part   it is      oh    big minus for  lack  playable chaos in this part   this does not really count for my   but i would like  see them       it has   worst single player campaign in  whole series that feels like skirmish with additional character lines  some objectives   do not buy it   wait for next part that will hopefully be better ,0
awesome  d for  empire ,1
it is fun  it is good  so everyone should get it ,1
yes,1
even better than    i loved    that game for  long time  very     highly recommend this for fans     universe  anyone that   well made  rewarding in depth rts   they removed  skulls thing so u have access   majority  doctrines from level    all   elites   campaign has taken  different approach  previous campaigns with great story line   awesome cinematics ,1
thats an  with high quality graphics nice story  active  thats an really good game,1
 doesnt even do my    where is  grimdark  where is  base building  where is everything that made dark crusade great  where is an    story   i get more entertainment from   than this garbage ,0
 disgrace  warhammer   franchise  they took everything that makes   good   they removed them like  joke damn shame  call this shallow garbage  ,0
better than launch,1
wtf is wrong with you guys  this is one   best rts game since   also one   best looking ones  overall  for me   best looking game in  warhammer universe  i can not believe it  such  piece  art is not  well   community  relic  you made such  great game   so sad that we will not see some more updates or dlcs   ,1
good,0
felt like  dawn  war game but with enough spice  make it different ,1
crap,0
absolutely disgusting  stupid gameplay  story line  space  attack again  humans look like dumb  again fighting against  eldar who are trying  save  freaking universe  game plays as  moba  sorts even with all  changes   levels are small  look like   upgrades take forever  gameplay is  around using heroes since everything else takes forever  build because even with maxed resource points they simply generate too little  both   graphics are quite decent  instead  making this crap  they should simply remade dow soulstorm or   retribution with  graphics  better soundtrack  it is like they are trying hard  make  low quality game that   lot  instead  making  fun game that everyone would enjoy,0
more content would be nice,1
what  disappointment   just how  up  moba multiplayer part   game is  which many other people have already  on    single player is just poor  with no difficulty  or  challenge    final mission  what an   game design   spirit  dow   let us take away all your base building   your armies  just give you   elite units for  whole mission  which ends in   boss battle  which you have  micro manage  win  it is    what made dawn  war  good rts  i got this in  humble bundle  glad i basically did not spend any money on it  spend your time  hard earn cash on something else  i feel so sorry for    sound   developers etc etc that worked on this  they were lead down  wrong  by designers  marketing wanting  get onto  moba bandwagon ,0
such  shame this game tried  be something it should never have been  it failed  for that we may never see another dawn  war game again    i loved this franchise  i guess it is back  soulstorm apocalypse mod then  ,0
just played through all  dow games up  this one   i only played it  bit  but did not like what i played  judging from all  other reviews it does not get better  they did not try  fix it  seems they should give  dow series    make  tw with when they finish warhammer fantasy ,0
classic,1
an insult  dawn  war  wtf happened ,0
amazing game,1
this game  down    setting   characters are awesome  but  game itself is pretty shallow with non existing tactical depth  also   three races have  exactly same play style  build  bigger army    enemy  very disappointing considering how different    orks are supposed  be  also   cover system    my   what were they thinking  only recommended for  fans   dark  ,0
dawn  war more like fun game ,1
loved  first dawn  war  all  expansions  less  on dawn  war   but still enjoyed it overall  i have no idea what  developers were thinking when they made this  it seems  have dropped everything i enjoyed about  last   games   scale      cover mechanics tactical gameplay    it is  matter  personal taste really but i also really dislike  cartoony look they went for  graphics  i played   for over   but could not make it past mission   or     campaign in this  after  few multiplayer matches  i hated it  uninstalled ,0
just beat  campaign  i see why so many people were upset by this game  wait for it  go on   sale     lack  missions  last mission is  chore  i did not have fun  was ready for it  be over    feel cheated out  cinematics  replaced with  still    story was okayish    least i got my  ,0
i have never played this game  please disregard this review,1
it is just  bit meh  i never even managed  finish  campaign first time through   it  it is just no fun which is  real shame as i was  big fan  dow,0
this is  solid experience  well worth  price   for  general   fan   care is taken with  lore  characters  over   but  be fair   this game  with  formula   previous dawn  war titles   it with  far more linear experience   i would be   call it   down  rts as  simplified  faster rts  experience because there is no failure here on  part   developers   it is   choice than many franchises might adopt  but there is plenty here for      series   newer gamer   at   cut  you simply spam  units needed for   at hand  but there is   reward for     by  campaign  multiplayer options   very   extremely loyal     universe  solid overall ,1
blood for  blood god,1
 great game  left   by       mod community have come      make this game still worth    worth  effort   ,1
i do not know what  game was like on release  but  game is absolutely  i enjoyed every moment  it  love  play it with friends   only problem is  online player base  its not very active   devs should make  free version where you can only play as  empire  man with   limited elites so  game gets  casual player base  also making dlc factions for     piece like  tau  chaos  dark eldar  necrons would be  super nice addition   my advice though is  turn off elites  doctrines on your first matches  as  elites are super micro manage heavy  need  get used too   its likely true however that it  way too much from starcraft  i would also highly advice  only buy this game during  high sale ,1
there are few examples in video games   potential worse than dawn  war iii ,0
 intro cinematic is    campaign is fairly good  but this game has sadly been  at   board  too much complexity for  sake  complexity  off putting models  cartoony animations  very few races  choose from  too much trying  be  moba  as somebody with   hours in      it  me  say it  but this is  huge  ,0
bland  too few factions  too little story  compared with dow  dowii  massive   maybe i will give it another try in  future    but i doubt it ,0
i played tons  dawn  war   i would still come back  it over this time  again   main reason many   fans  about dow was for  story  campaigns  which this game basically  into   i received this game for free via  press account  still  it because i knew i would never play it again ,0
 storyline is lacking   gameplay is monotonous   controls are also  ,0
mid,0
several bugs in  menu  in game  story is weak  seems like they  this after starcraft versus trying  do something unique for gameplay ,0
very good,1
meh,0
do not bother with this  not worth it even on sale or humble  combat does not feel   controlling units  their  is clunky  you can more or less just attack move everything  focus on managing just your elites   multiplayer mode has some fucked up moba  in place for no real reason   sp campaign forces you  play all   races  changing   next race every mission  so if you do not like one or two  them  you are gonna hate it  probably drop it rather than put yourself through that  only care about space marine  or eldar  or orks  tough luck   only   out    missions is gonna be   you then it is back  another two you do not give  shit about  no thanks  dow     master race dow     ok  but overall worse sequel  except for maybe rpg sp elements dow      ,0
while  great idea in concept   plan     basic units created through base building has  in  game that is either  dull   or  generic hero   i assume  developers thought this would be an easy cash  as   fans love their hero units   with  minimal number  special units   army  system   only   races there was  obvious structure  for    style  system  as there is no longer any support   game is   die  hopefully  devs clean   come back with  dow game that is worthy   previous titles ,0
completely different   amazing dow   devs took nothing great from their previous games  when everyone hated it they abandoned  game  do not bother ,0
someone obviously put  lot  love into  animations    lot  thought into     sound design is  as well  those   are  joy  listen too   this game is perhaps  most gorgeous rts i have ever played  some   game play elements are  such as  hero units  i like them because they add     game styles you can play  but they also further limit your unit selection in an already   game  over all though  matches are fun  fast paced   atmosphere    music   combination  is also incredible  if you like warhammer   or rts games you will have fun with this one  some   units do not behave like they should  but there is no better way  experience  grimdark world   ,1
i am not too bothered about  multiplayer aspect  so far i very much enjoy  game   campaign is fun  i enjoy   solo skirmishes against ai  while i miss some minor things found in   previous   like  recall retreat button   game keeps me engaged  i keep coming back for more ,1
great game have played both previous dawn  wars  love  warhammer   games,1
meh not bad,1
buy this game,1
game breaking can not continue bug on mission  ,0
well  this game sucks  i liked  first one  loved  second one  though i did miss  base building aspect  this one is just    not good   gameplay is  mess  often i would try  select multiple units  for some reason my  would just   some far off corner on  map  it feels slow    commands  there is too much focus on your elites while your actual army feels like cannon fodder  while at  same time bringing  much focus  your freaking unit abilities    it is just  mess   but  worst part though  while this may be very much   which one  you  designed this campaign  let me play my marines in   i do not want  jump from marines   orks   eldar   whatever comes next because i could not care  push through  ugh ,0
yes ,1
this may in  be  least   dawn  war games  but it is  in fact  still  good game    gonna hate  but    does not deserve   it is gotten   it is  decent rts that gets everything  right  but   single player campaign does make it hard  love  you are forced  skip from race  race with every mission  that makes it hard  develop any true  for any  them even by  end   game   another  let down is  lack   last stand mode  which by itself probably would have made        aside from that though  there is still fun  be had here in skirmish  multiplayer   it all looks great  too ,1
do i   game yes  do i recommend  developer publisher hell no      you  dawn  war franchise ,1
you like warhammer   play  game ,1
this is almost    game  you can play around with  single player but it is  multiplayer you are after  it is  most fun i have had in  competitive rts    joy  beating other players is really rewarding in this game  each battle feels intense  bad ass     dark atmosphere coupled with  visuals   futuristic war sounds makes this one   most unique experiences you will ever have on  pc   join our little community  see if you have what it takes  beat me ,1
great,1
i have only played  single player campaign   missions so far    it is good  not great  looks gorgeous  no bugs  but  start   campaign is confusing  playing all three factions   meaning you do not have time  get used  any  them  but half way through  missions improve massively  my biggest  with  gameplay is that most missions  long   time where you just wait  gain resources in order  create  upgrade units  otherwise  it is  more than  decent rts game   quite frankly i had  lot  fun with it ,1
visually this game is nice   it has interesting story for  blood ravens    characters  however   gameplay is terrible  controls   commands seem slow       un   this simplest things  such as  attack move command  seem difficult  give   track  this poor gameplay has sucked all enjoyment out  this game ,0
kinda  ,1
not worth  money or   space   ,0
its less   strategy game  more    story that i do not care  hear   cinematics make you think your going  have these huge wars like total war  warhammer  no  its  opposite ,0
how can you fuck up so hard   thats  only question i have for relic ,0
they took  good rts  turned it into  lane    it looks like they  out  money  gave up on   single player experience,0
such  letdown   game has  ton  issues  bugs   main campaign   progress  my elites several times  putting them back at     ai is   after  completing  mission it will sometimes show an empty pop up   your option is    restart  game  every time upon launching  game it  my   on windows  i either have  log out  my windows account  log back in or restart so it goes back  normal   stuff aside   story is boring  at least it is not  level  dow retribution  where you have  replay   same stuff but with  different races ,0
its not as bad as people say  im having alot  fun with it   fights feel   look cool ,1
barely  just barely worth it if you played  other dawn  war games  can get it cheap   they somehow managed  combine  worst parts from dawn  war    retribution   out any base building fun from dawn  war    it is utterly    there are fewer resource points so they basically do whatever  game feels like at  time   sometimes you can get power  sometimes resources  sometimes you can upgrade it  sometimes not  it is frustrating  annoying   actual game play is   but things like   do not have any  any more   still  for one play through i guess it was ok ,1
if you like  dawn  war games you will love this one just get it,1
honestly  complete letdown for  series,0
did not feel  excitement   other games  did not feel anything  got bored  fast  sad i loved  other ones  i got  cards     ,0
great mission based single player   breaking multiplayer,1
no redeeming qualities   sad end   good franchise ,0
i would not recommend this for   dollars    do not get me wrong this one  true   warhammer formula but     game  breaks  flow  things  also  multiplayer has little players left  i have only encountered   players in  multiplayer with only   servers  this is  good game but could have been better  btw rts games do not hold up in today is standards  this generation would find them boring but as someone who was  in  early   i have played  lot  rts games so i am familiar with  formula  they could have made this into     loot  shoot then this game would have been   there really is no strategy  just click  watch enemies die but still you can use strategy but that will make  game longer  less fun  i can not recommend this   ,0
 on   franchise ,0
  is not it   ,1
 this is  waste  time     money    first  all   rts is long dead   i was hoping they will do some dow ii game with loot   rpg mechanics game  but this is crap   story is boring  last boss s unbalanced    do not buy this   let them understand that we need dow ii style games without this outdated base building  we do not want   bases  we want  ,0
 game that  its franchise by losing its vision  identity  believing it can attract both rts  moba fans while lacking on either front   warhammer game with starcraft ii is vision but so inferior  it is enough reason for you  just continue playing starcraft ii ,0
 only game i was   refund because i waited   hours  get  match  did not get  match  did not get  money  did not finish my  either  my  abandoned me   ,0
if you like company  heroes series  total war series     you will love this game ,1
am  fan  space marines so i like all that universe  for fans great for others recomend,1
this game is very ehh    i have not played it that long  i am already seeing flaws   factions seem very similar when in dawn  war      they were very diverse  for    you could get  other dawn  wars  that is  much better deal  it is not  bad game just very mediocre  you could get some good fun out  it  but for being  dawn  war game it is disappointing ,0
dow       are much better games   interface on this   is far too    graphics look like  mix between       it feels like  mobile game     do not bother ,0
this game is terrible even with mods ,0
not recommended  game abandoned by devs  no  why  would take an entire rebuild  make it good    bad enemy unit ai  no need for strategy or tactics   terrible unit   some units   map  are   even with  is  stop command    ranged units can    out when engaged in  only  stand there  die   negative resource army upkeep is never      units out      late game   units   you can attack behind cover walls if you have  making it one big open map   melee units can attack   units on top     makes for some dumb animations   doctrines exist but  selectable for  lot  missions  they include things like   while moving   other basic things you would expect from  start   mp is dead   simple things like  are locked down unless you grind elite units   unit  does not matter if you     game will  your entire army    stupid story bad  voice acting    let us wipe this ork from  board    not even grimdark  game throws you all over  place with sp mission structure  feels like they wanted  make an rpg rts moba  failed  ,0
 here is with   campaign mode   where dawn  war      were unique  fun in their own right    really let us  collection down  as  player  you are stuck playing  you would possibly never usually play  so your   in  story  campaign is minimal   campaign tries  tell   story   but does not  you  make  connection with     so  i  at least found myself not really caring    i also was not big on  mechanics  there are too many individual unit mechanics  jumping around  make this easy  get into  there are probably some fast  starcraft   guys that love this sort  thing  that said  i just could not get into it    it is flashy    at  same time   me it seemed there was not much substance    where  rest   series is    for me ,0
it was  fun game  i enjoyed it  i would recommend on sale,1
hot garbage  does not even hold    dow i  ii,0
i got this game in  humble bundle which means i payed maybe two dollars for it  i regret that purchase  this game is  far cry from  first two in  series    my reasoning  this game plays itself  all i have  do  beat  mission is  troops  any troops   mass them into  big   people  throw them at  enemy  in  first  second game there was much more strategy involved   stories that they told made me  in    each battle  i barely care about this game enough  give it this review   only reason you should buy this one is if you have  first two  want  complete your library  are okay with wasting money  do so ,0
great game,1
awkward  clunky   slow  try   original dawn  war instead  this is not  game you are looking for  unless you like crashes ,0
warhammer doing rts right for  past   years   if you are  fan  starcraft  rise  legends  warcraft iii then you will feel at home   plus  lore that  warhammer series  is      give dawn  war i  ii  if possible ,1
