Trimmed Review,Rating
i enjoyed  previous dawn  war with all   expansions  i also enjoyed dawn  war   which plays like company  heroes  small squads with  lot     best part   dawn  war series is  multiplayer with friends  i bought this game  immediately uninstalled it because multiplayer is broken where you can not invite yours team friends  i searched    this was an issue since   with     that it was  known issue  not being able  invite steam friends  play an rts makes me sad  do not buy this if you want  play with your friends  you will not be able  see any steam friends in  list  i am getting  refund for this garbage game ,0
my friends  i played  loved  other dawn  war games  we got this on steam sale because despite  negative reviews  we could play with each other  mess around  have fun        we could not invite each other  our party  there is no one listed in steam friends  using  steam menu  invite friends   game does not work  i  requested  refund  uninstalled  i can not believe that  game released in  last  does not have this  working ,0
i am going  try  write  review that could have saved me from purchasing this game    this game looks like  exact thing   dawn  war i player is hungry for  but it is mostly an empty shell   it would be  great    for those  us that loved dawn  war i  this game appears  finally be  decent sequel with base building    at first    it lives up  that   there are technically buildings you can build   but there is not much   game here    single player campaign is trash    all   races are  together  which means i have   through tedious ork  eldar shit before i can play space marines again   there appears  be only  single campaign  so for my money i have gotten about   levels  with one  them being  little more than  tutorial   some   new game mechanics  like these elite hero units are interesting  but there is also this mechanic where you have  choose different  for your army each game  like making your marine units run faster    this adds an  complexity   game though  how can i possibly gain  deep      its combat where there is are n  variations  gameplay    base buildings seems highly  also   you are no longer free  scale up power production at will   it feels like i am on     whole time    graphics are certainly  over dawn  war i   if it had   real  single player campaign it would be good   if it had anything close  dark crusade or soulstorm is campaign mechanics  it would be great ,0
this is such  garbage   game  if you like   please do not buy this game ,0
do not get this,0
for  couple  hours on campaign   tutorials i can tell   cons   its very bad that they   cover  building  mechanics    they basically imitate  moba style  play with troops as minions  elites as heroes   in  bad moba   bad dow   pros   visuals  elites abilities are ok    empire knights    campaign takes you through different factions on  single   better than doing  same campaign for every faction like on retribution   better off playing dow  ,0
good game  an interesting mix        im really enjoying multiplayer  singleplayer so worth  shot,1
 campaign is great  but i love  skirmishes more  ,1
it is  warhammer universe in all its glory  i do miss   game is base building though   ,1
this game  game is    is  pile  my   after poorly    i am unable  even think  creating   positive review on this game  how could you even think that i would never see this pile        do not you know  you make an     i am  god  very   could destroy  entire  system by simply   relic entertainment never do this again  ,0
great rts,1
great rts   amount  heroes   unit micromanagement remind me  warcraft   which i loved  battles are intense visually     i have played dow    this is unlike any  those  but it is  good game in its own   many people can not accept change ,1
i really do not understand  hate for this game  if you like rts games    you will have fun   base building elements are definitely weak  but  control points are   ,1
  sisters     every race heed not  call    gods  for this is not dawn  war    this is not  glorious  upon which     imperium have  their blood  this is  hollow     husk  barely  as      i got this game for     i still do not recommend buying it    fuck me it is gonna take  few days    get this taste out  my mouth ,0
this game was  biggest waste  money   developers gave up  content is shit  only three factions  it is basically  really bad moba for  ,0
this is  worst dawn  war game,0
with    steam community mods  maps available  dawn  war iii has finally been  far above it is original   vanilla release  i am enjoying this title now far more than i did when i purchased it on  release date way back on       i am  out  huge thank you   all  dedicated    extremely talented modders  map designers who have stuck with this title ,1
it is quicker than   ,1
this game has taken  lot  shit  but i would not consider it  bad game   bit uninspired    but not bad  it is lacking  bit  content  but what is there is decent enough   story was  enough  keep my interest up throughout  campaign  i would have preferred if there had been separate campaigns for  three playable races as  moving back  forth makes it harder  develop  feeling for  race  their    it is not worth full price  but get it on  good sale  you will get  fair amount    for your money ,1
my experience so far   hours gameplay  is not good     it was made as recently as   is  for  quality   tutorial by   voice  made me lose all will     in place for it were   i have already encountered  few random bugs  units moving but staying  etc   armies seem  be pointless compared   elites  as an elite can basically wipe them  which   question  why have  army  or why have  elite  some special abilities  elites are also   apparently launching over  large  is fine  though  can be found with small   wtf      standard army units   control  them is just ugh  you can select groups   which way they face when moving but they will not even consider putting melee at front  also most  them are happy  stand there  just get shot from    do absolutely nothing about it  so if you are being  by multiple   which happens  few times in mission   then you have  micromanage everything  it just makes  whole experience feel  little tedious  not that typical     there is no stance  that allows them  react  this  oh   every time i try  close  app after playing  game  it crashes  meaning i have  force   app down using my  system  i lose all experience  by my elites even though i played several games   good points  it was   for me on  deal  different  talk as you would expect them  talk i like rts games  this  rts game     i like   i am out,0
i am personally  big fan or rts games so this ones great ,1
      graphics         you  what  is   beautiful   good   decent   bad   don t look too long at it   paint               it does not have   bad   average   good   fantastic   make your own story   its multiplayer what did you expect        gameplay         very good   good   it s just gameplay       at walls is better   just don t       audio           very good   good   not too bad   bad           audience         kids         humans        pc requirements         check if you can run paint      decent   fast   rich    ask  if they have  spare computer        difficulty         just press      easy        easy  learn   hard  master   difficult   dark souls        grind         nothing  grind   only if u care about     isnt necessary  progress   average grind level   too much grind   you  need  second life for        game time        long enough for    coffee   short   average   long             price        it s free    worth  price   if u have some spare money left   wait for that sale drop   not recommended   you could also just burn your money       bugs        never heard    minor bugs   can get annoying     survival evolved    game itself is  big  for bugs   fallout         overall        it is so bad     ehh     oh yeah     not too      yes baby       i will add  campaign is good  play alone as it continues  blood ravens chapter  eldar   new   familiar      factions you will be playing as   space marines  eldar  orks   multiplayer is dead for good reasons as  devs abandoned it  never giving is  chance   it back from  dead  which is  shame since dawn  war  dark crusade    with its fantastic gameplay  choice  faction    wait for  big sale drop  pick it up for  story  skirmish matches with friends if possible   hopefully dawn  war   stops adding in factions we have played as previously  gives us something in return with  true dawn  war experience  that means no paid chaos faction  again as they love  do that in every warhammer series  blood pack ,1
 single player campaign is pretty interesting,1
being  fan   dawn  war franchise   how bad   was i still bought it       keeping true  each race   separate campaign would have been wonderful    for  series     elites  special  abilities  plus       unit control okay    unit upgrades  cool  i think though after playing it   jumping from race  race kinda got on my  always  tactics  i hope this does not kill   series  take  time  read what people want for gameplay   story is always   on top but listen   people   ,0
brilliant,1
fun game  i love   so playing as  space marines is amazing  plus playing  heroes too ,1
it is    dawn  war soulstorm ,0
note  i only played  campaign  only get it if  like me  wanted  have all  dawn  war games  i loved dawn  war    made several times  campaign  soulstorm expansion  i even liked  campaign  dawn  war   with  rpg elements  not so much  standard games because you would only make units  no buildings   but this game have very little  what i liked  previous games   basic thing that i loved about    universe is  gore  i did not feel it in this game  maybe because  unit models are so small but got none  them   game feels slow compared      other games  you have resource points but they generate resources  slow  some times i just had  wait in my base in order    force  start attacking  enemy because it was so slow   elite units in  campaign are nice but thats about it  i wanted  play this game because   titans  they are there  feel good  have that  power but you get them at  end   campaign so you can not enjoy them much   game lacks  most everything that i loved about  first game  liked about  second   shame because    universe is  great place for rts games ,0
its good,1
i have tried this game on two different computer        it is just    even   years on  i am sure it is  fun game  but i just can not recommend it  someone who wants  play  game ,0
fun game ,1
i tried really hard  like dawn  war iii  but   three games in  franchise this was   game   on  positive note  being able  use  titans was  blast ,0
brilliant update   dawn  war series  wish it didnt crash ,1
    short campaign      races only  no chaos  necrons  tau etc     meh multiplayer  buy only on sale ,0
from someone who is played  enjoyed previous   this series  take it from me that they completely  on this franchise  did an  by yet again    in game system  it went from base building rts   single unit control   mixture   two with  very vanilla storyline  they got  few  reviews   in  corner  decided  no longer support it   please only buy this game if it is discounted below  ,0
ok ,1
nice rts  awesome graphics,1
what  broken game  dawn  war    their  expansions are  much better than this piece  crap,0
actually i enjoyed it  dow ii was good but  elites  sheer increase in troop numbers makes this game more fun  dow ii was restrictive in  troop numbers  this is  big improvement ,1
bruh,0
  do not have any    animations do not look right  finished  first level  crashed     is like  different game from  series for    why change it if it is not broken ,0
i got this game some time ago  i did not remember why i never played it  today i tried again  now i remember   ui text scaling makes this game completely unplayable  i have searched around if after all these years they added an option or somebody made  mod  but no chance  will uninstall it for good  just  waste  hard disk drive  it is such  shame that  game  this production value is broken  just because  developer could not be bothered  offer  ui scaling option ,0
its  fun game  plus you can mod  hell  it,1
more squad based than  other games  though did bring back base building  bringing in  elite units   army doctrines  spice  game up more   i find there is no two games that play exactly  same    that being said  i very much wish there were more than just orks  space marines   eldar  very much lacking in  army options ,1
as   warhammer   fan  i like this rts game ,1
nice strategy game  perfect  combine   for this kind  games  for warhammer   in general ,1
i still bought it despite negative  after release  didnt play it much but i thought  purchase could help support development  i had hope that this game could be saved  just  few updates  more dlc factions  maybe  be as good as  ultimate apocalypse mod  but balanced    for   i hoped because this game has potential  unfortunately its abandoned  now my purchase was wasted   shame its  death  one   best   game series is out there as well  devs    should all be  for abandoning this game   series it  for  pathetic ,0
still prefer dow      think that  controls are off  sometimes do not do as u ask them  do  but still fun  d,1
if you want   rts buy dow      stay away from this game ,0
so much fun  ,1
its  great game,1
pretty decent single player campaign,1
single player campaign is great ,1
i have not played  multiplayer  but  singleplayer is just awful   it is essentially   just big  biggest mass  units  win  game  but with hero units that are almost  from  rest  your units that will   get lost in  rest  your units   good luck with that  because  hero units need  be  constantly   missions are full   which  when you  them   in massive forces from   so always make sure you have about     force needed  complete your next goal before you attempt it ,0
i loved dawn  war ii  but dawn  war iii is horrible   you play   different races  but instead    full campaigns   races are put in     result is   campaign with  races per mission  you do not even have time  get familiar with one race before you have  play another race for   more missions   i got  game on sale for around      any price higher than that is absolutely not worth it   now that i have play it  would i have bought it for    no  i would say  game worth   ,0
this great game,1
worth it on sale  picked it up for    no regrets,1
bought it on sale  considered it well worth  sale price     graphics  atmosphere   game is done very well      part   game is much more interesting as it has titan size units    its    dow       whilst an interesting idea doesnt quite work as waiting for certain resource points such as power takes  long time in game  units remind you  dow   types but are not as interesting in player  or as   although  disappointment  nevertheless   move by  developers   pity it did not work out well     story itself is  typical warhammer   nevertheless done well   story line in  is   there are story  however left   as  dow  warhammer fan however i still enjoyed it   get  game on sale    ,1
sadly by far  worst dow   singleplayer is so easy it is  joke  also it is more  moba with base building  than an rts  regular troops  only rarely needed  plus if used your hero levels slower    skills  unlock  nope nothing  do here     oh  your hero has just   left  fall back  screen   go get  coffee or do something else because after    he is back    health  even with  best skill you will have  do this   so killing is just  grind  there is no way    except being utterly stupid  going in  fight with low health ,1
great game  not  rts though,1
thanks  steam reviews  game was dead on arrival   it is hard  recommend it  average player count is usually below   so finding multiplayer games may be difficult   campaign was nice   it was fun for  time i played  looks great  gameplay is weird at times  heroes are op  shame we never got necrons ,1
i say this game is pretty  nice   any fans will appreciate it   ,1
it is like all  other games but worse,0
i have played both  dawn  war company  heroes   so on i knew  this company is great  doing strategy games   but let us say it clear   when i knew that relic was in charge  dawn  war iii  i was really hyped  now that i know that  relic is in charge  age  empires iv  i am really    ,0
i  enjoyed this game  bit  but i can only recommend it on sale  i got it at     even if it is not terrible by itself  actually  fun little moba rts hybrid for      it is   dawn  war game  with little resources or care  on it  half assed balance mechanics  poor   details   it has been abandoned by both devs  community   campaign missions are easy   even on hard but are quite varied  with bonus objectives  multiple   some   missions  there are resource packs around  levels  reward   early    final boss is  damage  with trash mobs  like   ones  but  difficulty here is way higher  against   storm   health pack management  heroes   mobs   boss stuns  are key  it is very  if compared   or   that were just  boring attack retreat loop   it will  some health  you will have three       your   clear mobs or pick up health packs  i like that  story it is mostly about eldars   best race   not  usual imperium vs chaos  i also liked that you get  play with all races  see their point    what i did not really understand was  whole reasoning       about  macha  because  bruh  me your strenght     when she would have   with   only   all     greater   or  throw away   eldar lives  except that it was also  bit   whole  lol just   battle  into  planet  who    with no  at all or noticeable    mediocre story without depth weight or memorable moments  except for     moment   entire    gameplay   gameplay lacks balance  its design feels like  bad  up  mechanics from dawn  war   dawn  war   starcraft    mobas   plus   it   ton  core mechanics  more in depth down below    base building first thing first base building is back   i like  lot that you can build your buildings everywhere since it    other good thing is that your production buildings are   little icons for an easy  quick alternative    but at  same time  lack  generators    locked  doctrines   multiple upgrade paths or  very fact that tech progression is literally based on your   not  specific structures   big  between all three races  are things that   remove any kind  build order  player choices or tech paths    build orders further  by  ton  potential upgrades  replaced by pre selected combat doctrines  elites   covers covers are basically gone  on   you have  control point that creates  destructible    makes all units  it   almost all kind  ranged damage instead  systems like destructible covers garrisons  light heavy cover  positive negative cover or garrisons  income upkeep  cap   whole management    upkeep is  complete mess   first  all you we went from      cap or      cap  an    population cap  but at  same time we have    upkeep  meaning that  more big your army gets   more slowly you upgrades tech progression goes   me this does not make any sense  an upkeep system works on  small armies skirmishes games like      upkeep  or warcraft     low upkeep     high upkeep   where you produce big armies  get  mid late game   knowing that at  same time you are losing income   down tech progression  but on dow what is even  point     cap when you start getting  at   population   bigger your army becomes  less you can advance tech or even produce power units  vehicles or specialized infantry  or get new units because your income  especially power  can go down  zero  here is  problem  how are you supposed   elites  tier   ultimates drop pods etc    or  with tons   units  no income   me it does not make sense  put an upkeep system thought for small armies in  game with this amount   damage  three elite units   titans  it is like  game wants you  start with very few units so you upgrade fast  tier    then play mid late game with  few tier   units     low price trash until  end  combat system my main problem with   combat system is that it tries  imitate starcraft     systems when dow is  different game  about tactical management  prolongued fights   certain   macro map control     is  game about   macro      micro with quick   fights    systems works well for   but are horrible for dow   units   damage  quick   completely remove your  tactical management  prolongued fights   since everything gets  in no time    problem  by moba  like  powerful elites   titan elites  overtuned ultimates   system that is basically all about  skills   crowd control  mostly stuns              long gone is   system    or even better     skill systems from   other thing i do not get is why still lock some doctrines  colors behind  grind  or even    even see non purchased skins  overall    cartoony  looks good on eldar  mostly mediocre or  with space marines   gabriel angelos looks straight from league     it is horrendous with orks  it is like they came out from   at times  voice acting is overall mediocre or   actually horrendous on orks  gorgutz   kills are gone  there is  ton  animations spells that  warhammer lore  like gabriel terminator backflip or  turned into     whole  interface is  bit   especially  heroes   storm style map that is not  into    works well for  but not for   even if i like  total war  unit icons    lot  sound effects  attacks  animations  voice lines lack any kind  weight or   super elites  imperial knights      are  best thing    they feel powerful  it looks amazing   with your army  by your personal     that is all i have  say about    mediocre  disappointing game  good for  few games  nothing more  it was impossible  save because it was badly  from  very beginning  especially   drive into e  where even starcraft   barely  even with  strenght  its name    do not be sad that   happened  be glad that it died before doing too much damage ,1
i am trying so hard  force myself  play this game so i can finally finish  available series     but its just so hard  get into it  yes it is more like   but it really is not like   at  same time ,0
this was  bit   miss for me  i will start by saying overall i actually like this as  game  it is just not  good dawn  war game  just about every aspect  this is  step back from dow   from  gameplay    campaign  even  soundtrack just does not have that same magic  previous games have  relic seemed  have had  bit  an identity  with this  while i can see how they tried    lines between   there is  number   steps that hold it back from getting    that vision  flow  let us talk about some      production quality is top   graphics animations are killer  it is got all   you want in  warhammer game   three races  play  each play pretty differently  have their own mechanics  level  skill  master   campaign let us you play all three races at once   between them  this works well as an  tutorial  sorts as you get pretty well  with all races by  end  it is also well voice acted  is plenty long with lots    some fun character       hero types  doctrines  you choose special bonus options for your troops before you start so you can customize play style  actually lead  some pretty interesting play styles  now some      while i did not mind  idea behind having heroes take center stage  for  most part they are way  powerful  it is really  race  getting  most powerful hero out because as soon as you do it is pretty much game over   visual  at late game  especially with multiple players is   there is so much going on at once your whole army will die in   seconds  you will have no idea how    above  me   fact  micro you need   play an army plus three heroes at once  especially if you are  weaker eldar  is insane  let me say that again  in  moba you play one hero  you can focus on doing it well  here you are expected  play three heroes  an army  only  micro god can play everything  way it is meant   it is not really fun   with everything   wrong  with  wrong heroes constantly    campaign is     fine but mostly an  in patience as you attack move your way through    it with stops  wait for  slow   requisition needed  rebuild an army that got   killed by enemies spawning in all around you like magic   story is  ok  but again  step back from previous games   power core mode is dumb  again an attempt  make  game more like  moba  it just does not make much sense with this kind  rts gameplay   you can fix this by simply playing annihilation mode    not enough maps  environments  modes  no last stand  even though this would be  perfect game for it    game is currently abandoned  dead  no one plays   ai is quite bad  this is  real  in   for me since if you got  game today there would not be enough staying power  make it worth  in  perhaps if you are  warhammer fan  pick this up for cheap you might enjoy it  otherwise you can just go play more    will have  better time overall so it is for that reason this game is not recommended by me,0
how  kill  franchise   everybody asked for      we get this  piece  trash ,0
dawn  war   is  pretty basic game for what it has  offer its basically dawn  war   but with    attached at  very end  campaign is ok for what it offers but  other then that multiplayer pretty much is dead for good  there is  bit  unit  with  workshop mods but that is basically it,1
more challenge than previous versions,1
do not know why they decided  take out so much   customization from   like    in this one you can not actually pick your characters  like in ii   camera is alot closer  i really like dowii but after about   hours  this one  its not great  just ok sort    it really   mind why they would take out character upgrades in  rts rpg  its really stupid ,0
its  ,1
