Trimmed Review,Rating
not  best dow but not bad either  if you are unsure get it on sale  give it  try  campaign has  similar feel  previous titles  took me  while  get used   slightly different game style but still feels like dow overall  unfortunately large armies are  bit awkward  look after  at that point  numerous unit abilities are  bit   i found abilities awkward  activate in  middle  bigger fights so i sometimes ignored hero      this game has had  lot  bad rep so i waited several years for  good sale   before trying it   i am glad i did not get it full price but i am glad i have played it  i think they could have turned it into  much better game with  solid patch   i just hope  next game moves away from     per minute  emphasis ,1
  good game  reminds me  coh   which i also love    game is not as dead as some seem  believe   i can find  match within  minutes late at  when no one should be on   i got it on sale  would not have bought it full price  but it does not deserve such bad reviews  i believe most bad reviews are from people who were already fans   franchise  got disappointed ,1
this game is fun  somewhat  but  entertaining ,1
let us either have  remake     collection so we can get  old   feel back with high end graphics  or  let us get    with all  factions from         survival was really fun     has  ,0
it doesnt have half   real units  factions in warhammer  it just isnt that fun anyway,0
campaign is so boring  poorly acted that i can not keep going  gameplay mechanics are outdated  poorly   even for    it is not worth it ,0
i actually think this game is pretty awesome   visual effects  sounds are great  people are upset that its not close enough   original dow but i am judging it as its own game   on that   it is pretty awesome ,1
wonderful graphics  intense battles  epic  say  least ,1
for someone who is new   warhammer franchise  has never played dow   or    i have  say that this game is very good   i have been an  gamer my whole pathetic life  at my age its hard  find games that are appealing   definitely worth every penny ,1
i know i know  this game does not have as many playable empires nor does it have as many vehicles or customisation as  original dawn  war but hell  i enjoyed it  fun campaign  multiplayer is pretty decent  good buy for  price ,1
this game took way  much un fair hate  sure  multiplayer was  failure but  campaign is actually very fun  had it not been given so much hate at launch  it could  fixed its multiplayer  been  great game  but now   dead game  i would  loved  get necrons  tau     rest with this level  graphics   shame,1
rip dow,0
this game gets   lot  bad press  it is true that it is not as fleshed out as  previous titles    but  graphics are  done  they really bring   from my   life  particularly  eldar look amazing    multiplayer for this game is fun  action  with good   i wish more people would play  it is definitely worth  sales price   it is  shame relic never fully finished making this game all it could be  but it is still  fun game as it is ,1
great game wish they add more people like chaos  stuff from   game ,1
amazing   just needs chaos space marines,1
i do not give  fuck about dow  dow ii  this is  solid rts ,1
if your computer can run this game  its super fun  got it for   dollars  it was worth every penny  not as many factions as dow   or   but more fun than dow   not  mention it has  ork  eldar titans ,1
i played   ii   this game was just terrible  awkward mechanics   was annoying  camera  annoying   through for   hours   gave up out     tired  storyline  orks are attacking imperial forces  space marines come  save  somehow eldar are involved  but it is really  plot  chaos all along ,0
i guess for  fans only  not good for new players,0
any warhammer   game is interesting  me  as third installment  dawn  war series it is  must have  game  game itself is good  not great but good enough  complete  story  gabriel angelos  blood ravens chapter ,1
it has good graphics,1
these graphics  models    i feel like i am playing mobile strategy  not  dow   dow   are much better  i completed   missions  then i had no   continue even though  next mission was eldar one which is my favourite race ,0
worth  sale price ,1
fan  dawn  war   or   avoid this game  it is utter trash  does literally everything wrong  should not even be possible,0
 game was abandoned by devs  is it worth it at its current state  no   only   hope were  promised updates that never came  they will not deliver promised updates  because  game underperforms  but  game underperforms  because they did not deliver  promised updates  they said they were going  focus on other titles  good for them  i am going  focus on other  that do not abandon unfinished games ,0
boring  does not feel like  dow game ,0
great game ,1
this was  miss gameplay wise    ,0
can not believe i had this game     perfectly good disk space  finally got around  it   finished  campaign in casual  time for uninstall  this is prolly  worst game in  series   it doesnt provide anything   its another try   together strategy  rpg  it kinda worked on dow ii  but not this time  this game features very slow units  including   eldar in    d    tedious missions    that is usually  in  mess  units  effects  mostly useless elites  imperial knight kind  op   single camera angle that sometimes changes during missions    chaos did not see that coming     who gets  down for  final battle    this game also has maybe  best intro movie ever created  so its not total loss  in     rpg   dow ii    strategy   dow soulstorm just  myself  get  taste  sega from my mouth  ,0
finding it  be  fun experience  takes  bit  getting used   it never feels like you get energy fast enough  but i am having  good time playing it ,1
heard about dawn  war     remaster  something like that   should use graphics     ,1
i love this game    i recommend it  anyone  everyone   ,1
any fan   warhammer   universe should have  great time with this game ,1
tldr   it is  fun game for  solo multiplayer  last part   campaign  do not expect anything complicated or nearly as interesting as  previous games  however   game can be incredibly fun at times which i can recommend  on  deep deep sale   game has it is really fun moments from time  time   graphics  sound  music  voice are really good which is why i did not write anything about them    i have tried writing this review  few times right now but there are so many things right  wrong with  game  however it does not  at anything   bad things are incredibly noticeable  annoying   keep in mind i only speak for  campaign   ai multiplayer part   game  that only     total players have finished  campaign in normal difficulty when reading other reviews   game with less than   hours which is  average playtime  it   speaking   campaign  i have   it in half as    quality  it changes drastically  note  missions take an average    minutes  complete  not  joke    missions   final boss  some missions may take even longer if looking  complete  side objectives     first half  it is  mess  boring  dull  confusing  you are just  into it with no   what is even going on or why you are doing  things you are doing   if you have not played  first two dow games  i have played them  finished  still had no idea  what was happening for  most part     game takes more than half   game  fully  its mechanics   player  so you are mostly locked into  units  game wants you  play  not what you may find fun or interesting or even allowed  experiment on your own with  different factions   missions drag for over   hour at times  however this is due      missions  which is for  most part  same except for  last mission   most missions start you up with your leader   few units   goal is  find  place  settle  base  then build units    enemy base  generators  towers   other buildings  on  map   this  as  building  is incredibly slow with limited resources  your generators taking forever  produce said resources  other missions start you up  same but it is   hold your ground  type  mission  these are  worst in my opinion  sometimes you just get overwhelmed by  attacks  not being able  produce defenses or units fast enough  all  this while trying  complete  side  all over  map with more enemies  which in turn requires you  build more units  take even longer  finish  some  these hold your ground missions even have      second half  once you get used   missions  how they  out  you can finish them  faster but still within          hour per mission   as  game  you are given  lot  free units  free resources throughout  map    need  wait for  generators  pump these resources  not only is it more fun  send your incredibly big army against  enemy  but also being able  use vehicles or different units as you experiment with them  this is  part in  game in which even though  missions drag on  you can actually have fun while doing them   there was one  mission which was    run stealth type  thing  which had  least combat but was  lot  fun  go through it    final mission was probably  most annoying   whole game  not only does it drag on forever but you are limited on  number  units you can use   final boss has some  attacks that pretty much  your leader   wasted opportunity for  good premise   ending is lackluster  definitely not worth  time spent on  campaign  there is no resolution    that was at hand  you do not get any  post fight     game just  ends in  very  way except for  one  that  ork says before      talking now about  units  they are nothing compared   previous games  mechanics  use are completely different  most   units feel unbalanced or useless  even  vehicles feel lackluster     elite units are  absolute best in terms  use  visually  most appealing however you do not get  lot    use them  their full   not even in multiplayer as  match is nearly over when you have enough points   them  most unit abilities can be completely ignored  not worth  micromanagement  them especially once you have  bigger army it becomes  mess  try  select  use your units abilities    game throws some faction mechanics that improve certain aspects  units or their  or abilities  this comes as   from  first mission you do not even know which units are which so you just select whatever seems nice  they are not only  waste  time but also annoying since you are mostly just   same over  over during  campaign once you eventually know which unit does what    story is  mess at first switching between factions with you not knowing what is going on or how they   each other  however this all comes   clear after  first half   game  then you understand not only their  but also what  them  it  however  game  characters out   air for plot armor that makes it very confusing again  know what is going on   game is worth at  very low price for  campaign   few fun  against  ai  can not speak for  online multiplayer which is what most people play for so it is  their  against  game  play without comparing it   other games   franchise  you will eventually have fun with it just  around  battlefield ,1
impossible  play   locked continue button isnt  wtf,0
great game  love it,1
campaign is okayish  but by far  worst dow ,0
it is fun  but  somewhat shallow game ,0
 game has alot  problems with it    no risk style campaign  no real    no last stand   what is does great at is   game play  no  just war  if you are playing with friends this would be amazing  sucks there will not be anything added  this but  online was just  bad idea  i think if they kept it like just  better better    had last stand this would have been  great game  if it had  risk style  campaign it  made dow dark crusade  ,1
solid rts with good cinematics  art   voice acting   campaign  you through  three factions  tries   you for multiplayer while taking you through  story ,1
what  say  it is an awesome game  fully enjoyable  more playable than other rts on   that  only on apm or  mechanics  good job,1
 story mode is short  simple  only  few challenges on normal  honestly   games i have played  on other   on hard it really is not that challenging   game  enjoyable none  less ,1
play all  these back   original ones ,1
disgusting ,0
while i play dark crusade  soulstorm more than any other game  this one was seriously   i feel    i will also admit  that i would love  see  single campaign with  originals with one huge uber world with all  maps  make up  seriously massive game      mod can not be impossible for that   but no    was not  bad game at all    they kind  tried  bring  game back   original style  but with   graphics  they honestly lost out on something that was  seriously major thing   but then i feel they also failed with company  heroes in much  same way ,1
campaign is super fun with    story line  unfortunately can not say  same for multiplayer aspect  this game  in  dow ii was  far  game in every way  i hope next version  dow series is more like dow ii ,1
personally i like    do not understand  hate it got at release  just  they kept  cover tactic from     would have  down  game play   made  battles  bit more tactical  if you can get it on sale its well worth  look ,1
this game is an insult       shame,0
one  my biggest regrets in life is this game failing,1
 worse dawn  war i ever played  what  waste ,0
good,1
very disappointing campaign  not  patch on dow i or ii,0
it is fun in   but in   it is fairly meh   if i could vote  ameh   i would  but since i can not  i am  no     single player game is   tedious   i do not play pvp  so perhaps it is brilliant there  but based on other reviews  i expect it is basically  game which  you for being an   hyper focused      which is fine  if you are one  those   otherwise  stay away ,0
first  all  im really sorry for   who made     cutscenes   ost  those are amazing  but  rest  total rubbish   their good work down in     beating  dead horse here im sure  but this game is so bad  i do not know what  say  just played   space marine  this  from  same developer  yet  differences could not be greater  space marine is    this is utter trash   they wanted  make    dota clone  it shows  angelos wears terminator armor with         around like   ball  utter    i can not recommend this even on sale  get   space marine  pass this waste  your time ,0
so when i picked this up  i was so  that this was called  dawn  war  i could not play it  they made  really unique  awesome franchise so generic  bland  now after  lot  patches i beat  campaign  it is more playable but still just generic rts  further  story is     cinematic with    is  best one in  game  like most    cinematics  are just like    at best   final fight was tedious   ending  as fuck  can we just agree that this was all  hoping   on  cash grab by building up  franchise so it had  good rep  then  this garbage  just make that   which now that i think about it is kind  on brand for games workshop    i would recommend you play total war  i mean its fantasy  not   but maybe we will luck out  they will make total war  ,0
i very much regret purchasing this game at full price     if you want large scale combat  play  first dawn  war     tries  play on  large scale but since every single unit type has multiple special abilities   gameplay mechanics becomes overwhelming  frustrating    if you want small unit combat  play  second dawn  war     tries  play on  smaller scale but  sheer   units on  screen at any given time makes this style  gameplay pointless     third    dawn  war tries  be both  it just does not work    single player campaign very much plays like  grind  i did not enjoy it at all   i am very disappointed that they have essentially destroyed  dow franchise in  same  as   who have in  past destroyed amazing franchises like command   conquer       is  total waste  time  money ,0
glad i picked it up on sale  any more money  i likely would have felt like i wasted my money  you might be  as  why i have   hours then  well  that is easy   campaign   certain redux mod   campaign is really meh  but i wanted  see it through  so i did  that took    hours   rest was using  redux mod for this game   that mod makes this game enjoyable for  time  but even that got  bit boring over time   pick it up when its on sale for  ,0
glad i paid    ,0
very bloody,1
burn    this game is  failure in all levels  it is not fun  it takes  squad base tactics  dow    makes them much worse     has as shitty voice actor   single player is boring   missions drag on   why was this game made    kids need  not be allowed  make games    here is how you fix dow   relic  bring back glory kills  bring back bases  actual bases  hero is need  be weaker  not  point   game  keep  squad level ups   make  really massive player game like in dow    which allows you  have real  for  blood ravens   world they fight on   or say fuck it make another game like this  fail again   relic i have played almost every game you have made from  on  this is below you ,0
not  same experience or feeling like  first   games but still  worthy   worth  money ,1
requires   play style than previous entries  this one is closer  straight rts than  rts small squad real time tactics    still pretty fun ,1
only played  campaign  here  pros  cons      good graphics  excellent animation   units  good warhammer feeling  means lots  war  death  action      story is ok  but  special     unit    units do not react while enemy units shoot them   is meh  you can  almost any mission with gathering  big army    enemy  boring   almost no  from  enemies on your base in  most missions  its pretty hard   enough  for  your units in some missions     game stopped  they even canceled content because it did not work well in  former   for example  elite units gain experience but can not increase in level anymore   overall i have had some fun moments with  game but can not  it because  all  flaws it has ,0
i wanted  best parts  one  two  i got  worst parts instead  whole things seems unfinished  few armies   boring hero  mechanics   not bad    graphics are good   writing is crap   story line is incredibly boring  linear  lack  choice really hurt this game  i bought this at full price  do not be   like me  do not buy it all ,0
it is fun,1
despite it is  lack  content  care from  developers    game is smooth  beautiful  it is not dow or dow ii but it has it is small qualities  there are plenty  extra maps  mods in  workshop  help put in  content that sega could not bother doing themselves  i recommend getting this game on sale  like i did when it was     using  revolution mod from  workshop for multiplayer   campaign is  made as well ,1
its not ok ,0
it is really not as bad as people   sad that dev is just gave up on it  i do   dev is for not  it  be as good as i could be  really needs balancing  space marines are  absolute god  not saying  other   races can not   just an  battle with      been playing dow since og release ,1
being  huge fan  all that is     fan    i did avoid this game due   bad reviews  but buying it on sale  completing  single campaign  it was not too bad  had  base building  large unit cap though there was something missing  but i am unsure what it was   graphics are good    skins are awesome  just wish it had more ingame close cutscenes like    you did not feel attached  any characters like  first two  plus you could see  ending plot twist   away after playing  first two games  though i will admit i am gutted there will be no more with  end     next   added races   i just wanted  play as chaos   ah well     ,1
what happen with elite experience   im  mission    all my elites are still in level   with   exp   going on   i earn exp in every mission  but at  next is   in all races my elites have   exp ,1
enjoyable with friends  only   this game is that you can only be   factions     missing  other factions   ,1
let us be real here  nothing beat  old games  i know  series lost fans after   but let us not look   horse in  mouth here  we got base building  good unit match ups  not great  not perfectly balanced  but good   really good resolution   servers are still up  people do still play  it is worth getting if your are  fan   series or  lore but not if you think it is gonna  dow  dow soulstorm ,1
bad game that  in  face off warhammer  ,0
you have    issues but worth its different kind  dow but fun,1
it definitely has its pros  cons but i think  game has  lot  potential  when i first played it i compared it heavily   other dow games  was not happy with my   although  seeing  game as its own product made me  that it does have  few    first off  graphics are great  there is  lot  consider   game mechanic  micromanagement wise  unit interactions   make  game more fun  enjoyable  buuuut there are    way that you can late game key units  like  imperial knight for example  is through  different resource that allows you  bring them out into  field  not so bad right  wrong   problem with this is that it takes forever  get that resource  you have  capture  specific  point  get it  so  if you want  play  late game unit then you have  do  well in  early game  hold onto that point against your opponent  have fun with that  another thing is that you only get three elites so you have  pick very  on who they are before   game  it requires  lot  thought because dow players are hard  play against  theres more  it but i do not wanna   game plus my  are tired ,1
fun  challenging in multiplayer   ,1
its fun ,1
game blows,0
this game moves further away from  base building     continues  smaller scale battles    both  these styles choices were moving in  opposite direction  what i wanted for me   lack   defenses in  campaign forces you  either  your  forces   or  in esports level  micro  keep on top  things   frankly  i am getting older  just do not want  play  game that fast paced   demanding  i play games    not hyper    quit    i  that this micro heavy direction was   attempt  attract  star craft   style esports crowd but it utterly turned me off   i think  elites  their art style were made  look like   alternative  dota  both  these likely  decisions  utterly flat for me    voice acting was okay but still  step down from   heroes  previous titles    ai was non  for your forces which you can expect  stand in place until death when shot    level design was okay at times but felt very   linear in nearly half   maps  i wanted  skirmish type battle which only  later in  final missions ,0
very nice for  singleplayer content  campaign is fun  has  warhammer feel  it  three races seem small in number  however not bad ,1
 in   that could  been great if relic bothered  update it in  same style as dawn  war  ,1
i got this game on   sale  still mildly regret it  while it has all     dawn  war game  it is missing  spark that made  previous games enjoyable    i bought  previous dow games purely for  campaign  still felt like i got my money is worth  i have now made it about halfway through this campaign  just can not bring myself  finish it  my biggest complaint so far is that army management is  chore  fair warning  i am typically  marine   player on starcraft  so micro managing is not really my   that being said  this game somehow has  worst  both worlds  there are more units used than in    several  those units each have special abilities that you will want  activate at key points in  fight  this requires keeping track  units easily    between them   hero units you will be using  this feels  with  increased size   army      while  army size increased   management tools have gotten worse  i was unable  find  via  game  or by sheer chance   ability  add  unit  an existing control group without having  remake  entire group  in previous games i have played  number creates  group   shift number adds  selected unit   previously created group  this is extremely  as you progress your army  make more units   same   without that ability  having something as simple as  control group for all your units becomes  chore  every  single  time  you make  new unit  you need  group everything back up  separate via    create new units  if you have units in multiple control groups  e   ranged  stealth  then it is even more      game seems  want you  create larger armies  but lacks  tools  enable this    in short  i would not recommend this game  anyone that is  fan   series  is looking for more single player content  it seems they have   have  best  both worlds  have failed     requires you  build  larger army   management tools do not enable you  do that easily   campaign lacks  customization  fun from  previous entry  just feels  bit flat  i have not tried  multiplayer  but that is not what i buy these games for  i would recommend  this one ,0
let up  our  in  moment   for  original  is gone forever   as  years go by   from  loss  such  has yet  be   that being said   is  better than   in every way  after getting through  first couple intro chapters   game opens up     joy starts  build  it may not capture   essence but in its attempt comes  spark  nostalgia   i find myself wanting more  if you are  fan   original  this game is on sale  grab it ,1
not good  get back  dow  ,0
 bit dull    bit buggy   it    or just crash outright fairly often ,0
lack  content but game just didnt get enough love for developers  add more but i enjoyed this game,1
  got his hands on  copy  gave it  me   game is not dow   or     good   i  i like  heroes  base building is back  looks    bad  almost all  it   factions instead    on base was  big     focus on  game being  friendly  them  remove  awesome synch kills because  synch killing unit is  which   balance  bit for  longer  ones  who thought that was  good idea    game is  so we will not even get more races    only part i liked was  heroes system although they feel  powerful    final score it gets   on  scale where   is perfectly average   it should have released with   factions as  base ,0
